{
  "connector_id": "ifc_22222222222222222222222222222222",
  "connector_protocol_version": 1,
  "credential_scope_sha256": "bbbbbbbbbbbbbbbbbbbbbbbbbbbbbbbbbbbbbbbbbbbbbbbbbbbbbbbbbbbbbbbb",
  "deadline": "2026-10-15T20:00:00.000000+00:00",
  "deployment_sha256": "aaaaaaaaaaaaaaaaaaaaaaaaaaaaaaaaaaaaaaaaaaaaaaaaaaaaaaaaaaaaaaaa",
  "grant_id": "pgr_33333333333333333333333333333333",
  "invocation_id": "pinv_11111111111111111111111111111111",
  "model": "gpt-test",
  "policy_sha256": "cccccccccccccccccccccccccccccccccccccccccccccccccccccccccccccccc",
  "protocol": "openai-responses",
  "provider": "openai",
  "request": {
    "body": {
      "input": "hello",
      "stream": true
    },
    "headers": {},
    "protocol": "openai-responses"
  },
  "request_limit_bytes": 16384,
  "response_limit_bytes": 32768,
  "route": "chatgpt-main",
  "schema_version": 1
}
